[
  {
    "Timestamp": "2023-05-01T19:00:00+00:00",
    "SupplierId": 0,
    "TariffUsage": 0.147281200000000000,
    "TariffReturn": 0.12172
  },
  {
    "Timestamp": "2023-05-01T20:00:00+00:00",
    "SupplierId": 0,
    "TariffUsage": 0.142659000000000000,
    "TariffReturn": 0.11790
  },
  {
    "Timestamp": "2023-05-01T21:00:00+00:00",
    "SupplierId": 0,
    "TariffUsage": 0.134358400000000000,
    "TariffReturn": 0.11104
  },
  {
    "Timestamp": "2023-05-01T22:00:00+00:00",
    "SupplierId": 0,
    "TariffUsage": 0.119160800000000000,
    "TariffReturn": 0.09848
  }
]
